{
    "id": "zombies_declassified",
    "type": "map",
    "name": "Zombies Declassified (DLC 5)",
    "author": "Logo-2K",
    "version": "beta2",
    "description": "A work-in-progress PC port of Black Ops II's unreleased fifth map pack, made for Plutonium. Each map is ported, polished and bug fixed to play as close to an official release as possible.\n\nBeta 2 includes nine maps, each with the Ray Gun Mark II in the box:\n[list][*]Nacht der Untoten\n[*]Verrückt\n[*]Shi No Numa\n[*]Der Riese\n[*]Kino der Toten\n[*]\"Five\"\n[*]Ascension\n[*]Shangri-La\n[*]Moon[/list]\nCall of the Dead is planned for the final release. Requires Black Ops II with all DLC.\n\nSource, progress and bug reports: [url=https://github.com/Logo-2K/zombies-declassified]github.com/Logo-2K/zombies-declassified[/url]",
    "images": ["main.jpg"],
    "files": [
        {
            "path": "mods/dlc5/mod.json",
            "size": 149,
            "hash": "0C1017169C545469",
            "url": "https://github.com/Logo-2K/zombies-declassified/releases/download/beta2-data/mod.json"
        },
        {
            "path": "mods/dlc5/mod_load.ff",
            "size": 560448,
            "hash": "0816CCF8401AD2A8",
            "url": "https://github.com/Logo-2K/zombies-declassified/releases/download/beta2-data/mod_load.ff"
        },
        {
            "path": "mods/dlc5/mod_load.ipak",
            "size": 15499264,
            "hash": "54C9491ECFA597A2",
            "url": "https://github.com/Logo-2K/zombies-declassified/releases/download/beta2-data/mod_load.ipak"
        },
        {
            "path": "raw/maps/mp/animscripts/zm_dog_combat.gsc",
            "size": 17353,
            "hash": "6155D1B2AACF9ED2",
            "url": "https://github.com/Logo-2K/zombies-declassified/releases/download/beta2-data/zm_dog_combat.gsc"
        },
        {
            "path": "raw/maps/mp/animscripts/zm_dog_stop.gsc",
            "size": 6564,
            "hash": "284C8729A899CF1D",
            "url": "https://github.com/Logo-2K/zombies-declassified/releases/download/beta2-data/zm_dog_stop.gsc"
        },
        {
            "path": "raw/scripts/zm/zzz_zm_dogfog.csc",
            "size": 797,
            "hash": "E697B0DB799C52F3",
            "url": "https://github.com/Logo-2K/zombies-declassified/releases/download/beta2-data/zzz_zm_dogfog.csc"
        },
        {
            "path": "raw/scripts/zm/zzz_zm_factoryfog.csc",
            "size": 998,
            "hash": "FB3A2891C435996A",
            "url": "https://github.com/Logo-2K/zombies-declassified/releases/download/beta2-data/zzz_zm_factoryfog.csc"
        },
        {
            "path": "raw/scripts/zm/zzz_zm_factorypower.csc",
            "size": 482,
            "hash": "DC9DB36DED90D44D",
            "url": "https://github.com/Logo-2K/zombies-declassified/releases/download/beta2-data/zzz_zm_factorypower.csc"
        },
        {
            "path": "raw/scripts/zm/zzz_zm_gglow.csc",
            "size": 273,
            "hash": "5E308C3E13C32098",
            "url": "https://github.com/Logo-2K/zombies-declassified/releases/download/beta2-data/zzz_zm_gglow.csc"
        },
        {
            "path": "raw/scripts/zm/zzz_zm_location.gsc",
            "size": 189,
            "hash": "CB2EEA2667AC9D0F",
            "url": "https://github.com/Logo-2K/zombies-declassified/releases/download/beta2-data/zzz_zm_location.gsc"
        },
        {
            "path": "raw/scripts/zm/zzz_zm_moonsky.csc",
            "size": 566,
            "hash": "C6A639B3B749E24E",
            "url": "https://github.com/Logo-2K/zombies-declassified/releases/download/beta2-data/zzz_zm_moonsky.csc"
        },
        {
            "path": "raw/scripts/zm/zzz_zm_sumpffog.csc",
            "size": 964,
            "hash": "E5BAE57E7B8B2398",
            "url": "https://github.com/Logo-2K/zombies-declassified/releases/download/beta2-data/zzz_zm_sumpffog.csc"
        },
        {
            "path": "raw/ui/t6/mainlobby.lua",
            "size": 43047,
            "hash": "AD1264F9CC0A2557",
            "url": "https://github.com/Logo-2K/zombies-declassified/releases/download/beta2-data/mainlobby.lua"
        },
        {
            "path": "raw/ui_mp/t6/hud/scoreboard.lua",
            "size": 50914,
            "hash": "C9A328618BECAFD2",
            "url": "https://github.com/Logo-2K/zombies-declassified/releases/download/beta2-data/scoreboard.lua"
        },
        {
            "path": "usermaps/zm_asylum/as_zm_asylum.ff",
            "size": 38848,
            "hash": "346489067FD3DC60",
            "url": "https://github.com/Logo-2K/zombies-declassified/releases/download/beta2-data/as_zm_asylum.ff"
        },
        {
            "path": "usermaps/zm_asylum/bp_zm_asylum.ff",
            "size": 38848,
            "hash": "24582A79B925A6E0",
            "url": "https://github.com/Logo-2K/zombies-declassified/releases/download/beta2-data/bp_zm_asylum.ff"
        },
        {
            "path": "usermaps/zm_asylum/br_zm_asylum.ff",
            "size": 38848,
            "hash": "A79D065BCA3660F9",
            "url": "https://github.com/Logo-2K/zombies-declassified/releases/download/beta2-data/br_zm_asylum.ff"
        },
        {
            "path": "usermaps/zm_asylum/cz_zm_asylum.ff",
            "size": 38848,
            "hash": "A3483E0BA415D759",
            "url": "https://github.com/Logo-2K/zombies-declassified/releases/download/beta2-data/cz_zm_asylum.ff"
        },
        {
            "path": "usermaps/zm_asylum/en_zm_asylum.ff",
            "size": 38848,
            "hash": "7AE103A811AF5699",
            "url": "https://github.com/Logo-2K/zombies-declassified/releases/download/beta2-data/en_zm_asylum.ff"
        },
        {
            "path": "usermaps/zm_asylum/fc_zm_asylum.ff",
            "size": 38848,
            "hash": "D1085E0B7063C5D5",
            "url": "https://github.com/Logo-2K/zombies-declassified/releases/download/beta2-data/fc_zm_asylum.ff"
        },
        {
            "path": "usermaps/zm_asylum/fj_zm_asylum.ff",
            "size": 38848,
            "hash": "A886271D4F6FEE80",
            "url": "https://github.com/Logo-2K/zombies-declassified/releases/download/beta2-data/fj_zm_asylum.ff"
        },
        {
            "path": "usermaps/zm_asylum/fr_zm_asylum.ff",
            "size": 38848,
            "hash": "289A8843C1A3506C",
            "url": "https://github.com/Logo-2K/zombies-declassified/releases/download/beta2-data/fr_zm_asylum.ff"
        },
        {
            "path": "usermaps/zm_asylum/ge_zm_asylum.ff",
            "size": 38848,
            "hash": "3247E16806849DFB",
            "url": "https://github.com/Logo-2K/zombies-declassified/releases/download/beta2-data/ge_zm_asylum.ff"
        },
        {
            "path": "usermaps/zm_asylum/it_zm_asylum.ff",
            "size": 38848,
            "hash": "9237E00B2FED1411",
            "url": "https://github.com/Logo-2K/zombies-declassified/releases/download/beta2-data/it_zm_asylum.ff"
        },
        {
            "path": "usermaps/zm_asylum/ja_zm_asylum.ff",
            "size": 38848,
            "hash": "93CCD9AC9FEE2117",
            "url": "https://github.com/Logo-2K/zombies-declassified/releases/download/beta2-data/ja_zm_asylum.ff"
        },
        {
            "path": "usermaps/zm_asylum/ko_zm_asylum.ff",
            "size": 38848,
            "hash": "5C8C90999851DD21",
            "url": "https://github.com/Logo-2K/zombies-declassified/releases/download/beta2-data/ko_zm_asylum.ff"
        },
        {
            "path": "usermaps/zm_asylum/ms_zm_asylum.ff",
            "size": 38848,
            "hash": "68937F9055574922",
            "url": "https://github.com/Logo-2K/zombies-declassified/releases/download/beta2-data/ms_zm_asylum.ff"
        },
        {
            "path": "usermaps/zm_asylum/po_zm_asylum.ff",
            "size": 38848,
            "hash": "C0F4CEFDFC708A58",
            "url": "https://github.com/Logo-2K/zombies-declassified/releases/download/beta2-data/po_zm_asylum.ff"
        },
        {
            "path": "usermaps/zm_asylum/ru_zm_asylum.ff",
            "size": 38848,
            "hash": "26D35BCF960356A4",
            "url": "https://github.com/Logo-2K/zombies-declassified/releases/download/beta2-data/ru_zm_asylum.ff"
        },
        {
            "path": "usermaps/zm_asylum/scripts/zm/zzz_protoround.gsc",
            "size": 712,
            "hash": "B54A4496D6A5D8BD",
            "url": "https://github.com/Logo-2K/zombies-declassified/releases/download/beta2-data/zzz_protoround.gsc"
        },
        {
            "path": "usermaps/zm_asylum/scripts/zm/zzz_zm_ambflies.gsc",
            "size": 2093,
            "hash": "8D1D211F41290C47",
            "url": "https://github.com/Logo-2K/zombies-declassified/releases/download/beta2-data/zzz_zm_ambflies.gsc"
        },
        {
            "path": "usermaps/zm_asylum/scripts/zm/zzz_zm_boxthunder.gsc",
            "size": 778,
            "hash": "EC74FB182A6B709D",
            "url": "https://github.com/Logo-2K/zombies-declassified/releases/download/beta2-data/zzz_zm_boxthunder.gsc"
        },
        {
            "path": "usermaps/zm_asylum/scripts/zm/zzz_zm_cscprobe.csc",
            "size": 107,
            "hash": "9FB3A62B567801D4",
            "url": "https://github.com/Logo-2K/zombies-declassified/releases/download/beta2-data/zzz_zm_cscprobe.csc"
        },
        {
            "path": "usermaps/zm_asylum/scripts/zm/zzz_zm_deathsong.gsc",
            "size": 2112,
            "hash": "0A81EF381E203499",
            "url": "https://github.com/Logo-2K/zombies-declassified/releases/download/beta2-data/zzz_zm_deathsong.gsc"
        },
        {
            "path": "usermaps/zm_asylum/scripts/zm/zzz_zm_exertvoice.gsc",
            "size": 3065,
            "hash": "08F6E26491088CA6",